{
 "vectorsFormat": "lattice-persistence-vectors/1",
 "description": "Conformance vectors for the canonical N-Triples of a payload and for the request digest (ADR-A132 decision 4, ADR-A123). Verified by verify-vectors.py with openssl, which shares no code with a library.",
 "ntriples": [
  {
   "id": "nt-sorted-deduplicated",
   "description": "Three triples given out of order with one repeated. The lines are sorted and the repeat is dropped.",
   "triples": [
    {
     "s": {
      "iri": "urn:example:b"
     },
     "p": {
      "iri": "urn:example:p"
     },
     "o": {
      "iri": "urn:example:o"
     }
    },
    {
     "s": {
      "iri": "urn:example:a"
     },
     "p": {
      "iri": "urn:example:p"
     },
     "o": {
      "iri": "urn:example:o"
     }
    },
    {
     "s": {
      "iri": "urn:example:b"
     },
     "p": {
      "iri": "urn:example:p"
     },
     "o": {
      "iri": "urn:example:o"
     }
    },
    {
     "s": {
      "iri": "urn:example:a"
     },
     "p": {
      "iri": "urn:example:p"
     },
     "o": {
      "iri": "urn:example:n"
     }
    }
   ],
   "canonical": [
    "<urn:example:a> <urn:example:p> <urn:example:n> .",
    "<urn:example:a> <urn:example:p> <urn:example:o> .",
    "<urn:example:b> <urn:example:p> <urn:example:o> ."
   ]
  },
  {
   "id": "nt-literal-escapes",
   "description": "Only backslash, quote, line feed and carriage return are escaped. A tab, a non-ASCII character and an astral character are written as themselves, and a backslash before u stays two backslashes.",
   "triples": [
    {
     "s": {
      "iri": "urn:example:s"
     },
     "p": {
      "iri": "urn:example:quote"
     },
     "o": {
      "literal": "say \"hi\""
     }
    },
    {
     "s": {
      "iri": "urn:example:s"
     },
     "p": {
      "iri": "urn:example:backslash"
     },
     "o": {
      "literal": "a\\b"
     }
    },
    {
     "s": {
      "iri": "urn:example:s"
     },
     "p": {
      "iri": "urn:example:newline"
     },
     "o": {
      "literal": "a\nb"
     }
    },
    {
     "s": {
      "iri": "urn:example:s"
     },
     "p": {
      "iri": "urn:example:cr"
     },
     "o": {
      "literal": "a\rb"
     }
    },
    {
     "s": {
      "iri": "urn:example:s"
     },
     "p": {
      "iri": "urn:example:tab"
     },
     "o": {
      "literal": "a\tb"
     }
    },
    {
     "s": {
      "iri": "urn:example:s"
     },
     "p": {
      "iri": "urn:example:unicode"
     },
     "o": {
      "literal": "café 😀"
     }
    },
    {
     "s": {
      "iri": "urn:example:s"
     },
     "p": {
      "iri": "urn:example:backslash-u"
     },
     "o": {
      "literal": "\\u0041 \\U0001F600"
     }
    }
   ],
   "canonical": [
    "<urn:example:s> <urn:example:backslash-u> \"\\\\u0041 \\\\U0001F600\" .",
    "<urn:example:s> <urn:example:backslash> \"a\\\\b\" .",
    "<urn:example:s> <urn:example:cr> \"a\\rb\" .",
    "<urn:example:s> <urn:example:newline> \"a\\nb\" .",
    "<urn:example:s> <urn:example:quote> \"say \\\"hi\\\"\" .",
    "<urn:example:s> <urn:example:tab> \"a\tb\" .",
    "<urn:example:s> <urn:example:unicode> \"café 😀\" ."
   ]
  },
  {
   "id": "nt-datatypes-and-languages",
   "description": "An xsd:string literal is written plain, other datatypes are kept, and a language tag is lower case.",
   "triples": [
    {
     "s": {
      "iri": "urn:example:s"
     },
     "p": {
      "iri": "urn:example:plain"
     },
     "o": {
      "literal": "x"
     }
    },
    {
     "s": {
      "iri": "urn:example:s"
     },
     "p": {
      "iri": "urn:example:string"
     },
     "o": {
      "literal": "x",
      "datatype": "http://www.w3.org/2001/XMLSchema#string"
     }
    },
    {
     "s": {
      "iri": "urn:example:s"
     },
     "p": {
      "iri": "urn:example:long"
     },
     "o": {
      "literal": "42",
      "datatype": "http://www.w3.org/2001/XMLSchema#long"
     }
    },
    {
     "s": {
      "iri": "urn:example:s"
     },
     "p": {
      "iri": "urn:example:lexical"
     },
     "o": {
      "literal": "042",
      "datatype": "http://www.w3.org/2001/XMLSchema#integer"
     }
    },
    {
     "s": {
      "iri": "urn:example:s"
     },
     "p": {
      "iri": "urn:example:lang"
     },
     "o": {
      "literal": "colour",
      "language": "EN-gb"
     }
    },
    {
     "s": {
      "iri": "urn:example:s"
     },
     "p": {
      "iri": "urn:example:empty"
     },
     "o": {
      "literal": ""
     }
    }
   ],
   "canonical": [
    "<urn:example:s> <urn:example:empty> \"\" .",
    "<urn:example:s> <urn:example:lang> \"colour\"@en-gb .",
    "<urn:example:s> <urn:example:lexical> \"042\"^^<http://www.w3.org/2001/XMLSchema#integer> .",
    "<urn:example:s> <urn:example:long> \"42\"^^<http://www.w3.org/2001/XMLSchema#long> .",
    "<urn:example:s> <urn:example:plain> \"x\" .",
    "<urn:example:s> <urn:example:string> \"x\" ."
   ]
  },
  {
   "id": "nt-sort-is-by-utf8-bytes",
   "description": "The lines sort by their UTF-8 bytes, not by UTF-16 code units. U+FF5E (EF BD 9E) comes before U+10000 (F0 90 80 80), which UTF-16 order would reverse.",
   "triples": [
    {
     "s": {
      "iri": "urn:example:𐀀"
     },
     "p": {
      "iri": "urn:example:p"
     },
     "o": {
      "iri": "urn:example:o"
     }
    },
    {
     "s": {
      "iri": "urn:example:～"
     },
     "p": {
      "iri": "urn:example:p"
     },
     "o": {
      "iri": "urn:example:o"
     }
    },
    {
     "s": {
      "iri": "urn:example:é"
     },
     "p": {
      "iri": "urn:example:p"
     },
     "o": {
      "iri": "urn:example:o"
     }
    },
    {
     "s": {
      "iri": "urn:example:z"
     },
     "p": {
      "iri": "urn:example:p"
     },
     "o": {
      "iri": "urn:example:o"
     }
    }
   ],
   "canonical": [
    "<urn:example:z> <urn:example:p> <urn:example:o> .",
    "<urn:example:é> <urn:example:p> <urn:example:o> .",
    "<urn:example:～> <urn:example:p> <urn:example:o> .",
    "<urn:example:𐀀> <urn:example:p> <urn:example:o> ."
   ]
  }
 ],
 "refusals": [
  {
   "id": "refuse-blank-subject",
   "description": "A blank node as a subject.",
   "refusal": "BlankNode",
   "triples": [
    {
     "s": {
      "bnode": "b0"
     },
     "p": {
      "iri": "urn:example:p"
     },
     "o": {
      "iri": "urn:example:o"
     }
    }
   ]
  },
  {
   "id": "refuse-blank-object",
   "description": "A blank node as an object.",
   "refusal": "BlankNode",
   "triples": [
    {
     "s": {
      "iri": "urn:example:s"
     },
     "p": {
      "iri": "urn:example:p"
     },
     "o": {
      "bnode": "b0"
     }
    }
   ]
  },
  {
   "id": "refuse-literal-subject",
   "description": "A literal as a subject.",
   "refusal": "LiteralSubject",
   "triples": [
    {
     "s": {
      "literal": "x"
     },
     "p": {
      "iri": "urn:example:p"
     },
     "o": {
      "iri": "urn:example:o"
     }
    }
   ]
  },
  {
   "id": "refuse-iri-with-space",
   "description": "An IRI with a space.",
   "refusal": "InvalidIri",
   "triples": [
    {
     "s": {
      "iri": "urn:example:a b"
     },
     "p": {
      "iri": "urn:example:p"
     },
     "o": {
      "iri": "urn:example:o"
     }
    }
   ]
  },
  {
   "id": "refuse-iri-with-angle-bracket",
   "description": "An IRI with a closing angle bracket.",
   "refusal": "InvalidIri",
   "triples": [
    {
     "s": {
      "iri": "urn:example:s"
     },
     "p": {
      "iri": "urn:example:p"
     },
     "o": {
      "iri": "urn:example:o>"
     }
    }
   ]
  }
 ],
 "digests": [
  {
   "id": "digest-create",
   "description": "Create. The payload part holds the new aggregate's triples. There is no expected seq, so that component is empty.",
   "operationKind": "Create",
   "target": "urn:example:person/1",
   "expected": null,
   "parts": [
    {
     "role": "PayloadPart",
     "triples": [
      {
       "s": {
        "iri": "urn:example:person/1"
       },
       "p": {
        "iri": "urn:example:name"
       },
       "o": {
        "literal": "Ada"
       }
      },
      {
       "s": {
        "iri": "urn:example:person/1"
       },
       "p": {
        "iri": "urn:example:age"
       },
       "o": {
        "literal": "36",
        "datatype": "http://www.w3.org/2001/XMLSchema#long"
       }
      }
     ]
    }
   ],
   "canonicalParts": [
    [
     "<urn:example:person/1> <urn:example:age> \"36\"^^<http://www.w3.org/2001/XMLSchema#long> .",
     "<urn:example:person/1> <urn:example:name> \"Ada\" ."
    ]
   ],
   "encodedHex": "363a43726561746532303a75726e3a6578616d706c653a706572736f6e2f31303a3134333a38383a3c75726e3a6578616d706c653a706572736f6e2f313e203c75726e3a6578616d706c653a6167653e20223336225e5e3c687474703a2f2f7777772e77332e6f72672f323030312f584d4c536368656d61236c6f6e673e202e34393a3c75726e3a6578616d706c653a706572736f6e2f313e203c75726e3a6578616d706c653a6e616d653e202241646122202e",
   "sha256": "480f822fedf63fe5ef3afcec5afad1adc53e65fca676bd30780e528b57cbfc55"
  },
  {
   "id": "digest-replace-patch-log",
   "description": "Replace under a patch log. Payload, add and del parts, in that order.",
   "operationKind": "Replace",
   "target": "urn:example:person/1",
   "expected": 3,
   "parts": [
    {
     "role": "PayloadPart",
     "triples": [
      {
       "s": {
        "iri": "urn:example:person/1"
       },
       "p": {
        "iri": "urn:example:name"
       },
       "o": {
        "literal": "Ada"
       }
      },
      {
       "s": {
        "iri": "urn:example:person/1"
       },
       "p": {
        "iri": "urn:example:age"
       },
       "o": {
        "literal": "36",
        "datatype": "http://www.w3.org/2001/XMLSchema#long"
       }
      }
     ]
    },
    {
     "role": "AddPart",
     "triples": [
      {
       "s": {
        "iri": "urn:example:person/1"
       },
       "p": {
        "iri": "urn:example:age"
       },
       "o": {
        "literal": "36",
        "datatype": "http://www.w3.org/2001/XMLSchema#long"